{"$schema":"https://json-schema.org/draft/2020-12/schema","title":"Adaptive Device V2","type":"object","required":["schemaVersion","id","name","manufacturer","inputs"],"properties":{"schemaVersion":{"const":2},"id":{"type":"string","pattern":"^[a-z0-9]+(?:-+[a-z0-9]+)*$"},"name":{"type":"string"},"manufacturer":{"type":"string"},"inputs":{"type":"array","items":{"type":"object","required":["id","name","kind"],"properties":{"id":{"type":"string"},"name":{"type":"string"},"kind":{"enum":["digital","axis-1d","axis-2d","pointer"]}},"additionalProperties":false}}},"additionalProperties":false}
